"Fishman J.A., Greenwald M.","Fishman, J.A., Massachusetts General Hospital Transplantation Center, Transplant Infectious Disease & Compromised Host Program, Massachusetts General Hospital, Harvard Medical School, Boston, MA, United States; Greenwald, M., Uniformed Services University School of Medicine, Silver Spring, MD, United States",Innovation in organ transplantation: A meeting report,American Journal of Transplantation,nan,nan,2018,18,8,10.1111/ajt.14928,https://www.scopus.com/inward/record.uri?eid=2-s2.0-85047745867&doi=10.1111%2fajt.14928&partnerID=40&md5=635e649c0b29cc4f1dbf62c8249b8e42,Blackwell Publishing Ltd,nan,4,clinical research/practice; ethics and public policy; informatics; law/legislation; organ allocation; Organ Procurement and Transplantation Network (OPTN); organ transplantation in general; quality of care/care delivery; Scientific Registry for Transplant Recipients (SRTR),English,Scopus,"This workshop targeted opportunities to stimulate transformative innovation in organ transplantation. Participants reached consensus regarding the following: (1) Mechanisms are needed to improve the coordination of policy and oversight activities, given overlapping responsibilities for transplantation and clinical investigation among federal agencies. Innovative clinical trials span traditional administrative boundaries and include stakeholders with diverse interests. Participants identified the need for a governmental interagency working group to coordinate nationwide transplant-related activities. (2) Improvements are required in clinical metrics for transplantation, with alignment of performance goals across transplantation organizations and any development of data requirements being consistent with those goals. Database coordination among clinical centers, organ procurement organizations, regulatory agencies, and payers would facilitate research and better inform policy. New data requirements should provide actionable insights into clinical performance. (3) Innovative research seen as potentially adversely affecting Program-Specific Reports may reduce centers’ participation. Cutting-edge research requires mitigation of risk-aversive behaviors created by reporting of clinical outcomes data. Participants proposed a new review process in advance of implementation of clinical trials to guide “carve-outs” of transplant center outcomes data from Program-Specific Reports. Clinical transplantation will be advanced by the development of a shared and comprehensive research agenda to facilitate coordination of research and policy. © 2018 The American Society of Transplantation and the American Society of Transplant Surgeons"
Pfaltz J.L.,"Pfaltz, J.L., University of Virginia, Charlottesville, VA, United States",An Algorithmic Approach to the Representation of Biological Information and Long-term Memory,"ACM-BCB 2018 - Proceedings of the 2018 ACM International Conference on Bioinformatics, Computational Biology, and Health Informatics",9.78E+12,ACM SIGBio,2018,nan,nan,10.1145/3233547.3233679,https://www.scopus.com/inward/record.uri?eid=2-s2.0-85056076515&doi=10.1145%2f3233547.3233679&partnerID=40&md5=841fabd02f42b81900519d2af9885a33,"Association for Computing Machinery, Inc","9th ACM International Conference on Bioinformatics, Computational Biology, and Health Informatics, ACM-BCB 2018",2,Chordless cycles; Closure; Consolidation; Long-term memory; Matroid; Neural network; Recall,English,Scopus,"Any concept of a long-term, relatively permanent, memory must include a mechanism for encoding episodic experiences into some appropriate format and later retrieving and recreating a reasonable approximation of the original ""episode"". Psychologists commonly call these processes ""consolidation"" and ""recall"" [8]. In this paper, we present two computable functions tht closely imitate these processes. Of necessity, we must posit a recording format. It will consist of a system of cycles which support very high information content and are, furthermore, commonly found as protein polymer structures within the membranes of all our cells. There seems to be consensus that our sensations, ideas, and memories are really just active networks of neurons in our brains [17]. We have a good idea where in the brain specific kinds of mental activity occur, e.π. [4, 10] But, to our knowledge, no one has any idea as to what kinds of networks correspond to any specific sensation, concept or memory. We represent these networks as undirected graphs (N,E) where N is a set of nodes, or neurons, and E is the set of connections, or edges. The concept of neighborhood, that is those nodes, or neurons, connected to a specific node y and denoted y.n, is central to our approach A node y is said to be closed if there is no node z ∈ y.n such that z.n ⊆ y.n. If we assume that information is represented by such neighborhood connections, then z can represent no more information than y, and its neighborhood. We say its role can be subsumed by y, and thus deleted with little loss of information. A network in which every node y is closed is said to be irreducible. © 2018 Authors."
"Kim J.-Y., Moon S.-M.","Kim, J.-Y., Dept. of Electrical and Computer Engineering, Seoul National University, Seoul, South Korea; Moon, S.-M., Dept. of Electrical and Computer Engineering, Seoul National University, Seoul, South Korea",(Poster) blockchain-based edge computing for deep neural network applications,ACM International Conference Proceeding Series,9.78E+12,nan,2018,nan,nan,10.1145/3285017.3285027,https://www.scopus.com/inward/record.uri?eid=2-s2.0-85058665701&doi=10.1145%2f3285017.3285027&partnerID=40&md5=49769ea9917f80f3e345c4745dfcb314,Association for Computing Machinery,"2018 Workshop on INTelligent Embedded Systems Architectures and Applications, INTESA 2018",3,Blockchain; Deep Learning; Deep Neural Network; Edge Computing; Machine Learning; Offloading,English,Scopus,"Deep neural network (DNN) applications require heavy computations, so an embedded device with limited hardware such as an IoT device cannot run the apps by itself. One solution is to offload DNN computations from the client device to nearby edge servers [1] to request an execution of the DNN computations with their powerful hardware. However, there are several issues with the solution. One is an availability issue that how we can provide the edge server with some incentives to run the client' apps. The other is a scalability issue that how we can use more servers when there are more DNN requests. Finally, there is an integrity issue that how the client can trust the result coming from anonymous edge servers. We think the blockchain technology can solve these issues to make edge computing more practical. This paper proposes a novel architecture for DNN edge computing based on the blockchain technology. Existing blockchains such as Ethereum do not support execution of a complex program, so we propose a modified blockchain structure and protocol to overcome the limitation. © 2018 Association for Computing Machinery."
"Samaniego M., Espana C., Deters R.","Samaniego, M., Department of Computer Science, University of Saskatchewan, Saskatoon, Canada; Espana, C., Department of Computer Science, University of Saskatchewan, Saskatoon, Canada; Deters, R., Department of Computer Science, University of Saskatchewan, Saskatoon, Canada",Smart virtualization for IoT,"Proceedings - 3rd IEEE International Conference on Smart Cloud, SmartCloud 2018",9.78E+12,et al.;IEEE;IEEE Computer Society;IEEE STC Smart Computing;IEEE TCSC;National Science Foundation,2018,nan,nan,10.1109/SmartCloud.2018.00028,https://www.scopus.com/inward/record.uri?eid=2-s2.0-85057304510&doi=10.1109%2fSmartCloud.2018.00028&partnerID=40&md5=c4d595018480d9d8dfad57e6e30a7265,Institute of Electrical and Electronics Engineers Inc.,"3rd IEEE International Conference on Smart Cloud, SmartCloud 2018",4,Blockchain; Cloud computing; Dew computing; Edge computing; Fog computing; Internet of things; Smart virtualization; Software-defined component,English,Scopus,"Nowadays, the cloud hosts the majority of IoT virtualizations. This approach depends on an active Internet connection. The question that emerges is how we can move those virtualizations to the edge of IoT networks without losing the power and flexibility from the cloud but fulfilling the requirements of constrained and pervasive environments. This research presents an architecture that integrates dew computing to provision virtual resources at the edge level. This architecture proposes smart virtual resources deployed towards edge devices to provide data views and IoT services to users. This approach goes beyond traditional IoT virtualizations and builds distributed virtual systems that include the benefits of the cloud, fog, and dew computing to provide services directly at the edge level. © 2018 IEEE."
"Aydin O., Assunção R., Janikas M.V., Lee T.-H.","Aydin, O., Environmental Systems Research Institute, Redlands, CA, United States; Assunção, R., Departmento de Ciéncia da Computação, Belo Horizonte, Brazil; Janikas, M.V., Environmental Systems Research Institute, Redlands, CA, United States; Lee, T.-H., Environmental Systems Research Institute, Redlands, CA, United States",Skater-Con: Unsupervised regionalization via stochastic tree partitioning within a consensus framework using random spanning trees,"Proceedings of the 2nd ACM SIGSPATIAL International Workshop on AI for Geographic Knowledge Discovery, GeoAI 2018",9.78E+12,ACM Special Interest Group on Spatial Information (SIGSPATIAL),2018,nan,nan,10.1145/3281548.3281554,https://www.scopus.com/inward/record.uri?eid=2-s2.0-85059044986&doi=10.1145%2f3281548.3281554&partnerID=40&md5=801ef2a8c59e5eb88eb53246368468ee,"Association for Computing Machinery, Inc","2nd ACM SIGSPATIAL International Workshop on AI for Geographic Knowledge Discovery, GeoAI 2018",4,Clustering; Consensus clustering; Constrained optimization; Evidence accumulation; Graph partition,English,Scopus,"Spatially constrained clustering, also known as regionalization, aims to group spatial objects into spatially contiguous clusters also known as regions. Among different approaches, tree-based partitioning is reported to define homogeneous regions rigorously, without ad-hoc adjustments, in a computationally efficient manner. One of the shortcomings of tree-based partitioning is the so-called chaining problem that results in sub-optimal regions. We propose a consensus-based regionalization approach to address the chaining problem associated with a single tree, in particular the minimum spanning tree, by exploring a wide range of partitions via a set of random spanning trees (RST). We propose an algorithm, namely SKATER-CON, that partitions spatial data via a consensus-based framework from an ensemble of regionalizations defined by its deterministic counter-part, the SKATER algorithm applied along stochastic search paths defined by RSTs. SKATER-CON utilizes evidence accumulation to represent an ensemble of regionalizations as a similarity graph. The similarity graph represents spatial objects as vertexes and frequency at which objects are assigned to the same region in the ensemble as edge weights. Proposed algorithm determines consensus among different regionalization by partitioning the similarity graph using a multi-level graph partitioning algorithm (METIS). Spatial constraints are imposed on the similarity graph prior to partitioning to ensure spatial constraints are reflected in the consensus result. We rigorously test the quality of regions produced by SKATER-CON on a large, synthetically generated dataset. The synthetic dataset is the result of full-factorial experiments designed on number, fuzziness, geometry and size of regions. Same dataset is also used compare our approach against state-of-the-art regionalization algorithms (SKATER and ARISEL). Lastly, we show the value added by SKATER-CON compared to SKATER on a real-world dataset based on Ecological Marine Units (EMU) dataset. © 2018 Copyright held by the owner/author(s)."
"Li Y., Shi W., Kumar M., Chen J.","Li, Y., Key Laboratory of Complex Systems Modeling and Simulation, Hangzhou Dianzi University, Hangzhou, China; Shi, W., Department of Computer Science, Wayne State University, Detroit, United States; Kumar, M.; Chen, J., Chain Oriental LLC, Beijing, China",Poster: DyCREM: Dynamic credit risk management using edge-based blockchain,"Proceedings - 2018 3rd ACM/IEEE Symposium on Edge Computing, SEC 2018",9.78E+12,Akamai;EdgeComputingConsortium;et al.;Huawei;Microsoft;NSF,2018,nan,nan,10.1109/SEC.2018.00039,https://www.scopus.com/inward/record.uri?eid=2-s2.0-85060238090&doi=10.1109%2fSEC.2018.00039&partnerID=40&md5=cd4c68d93450ac0dbe428bb73c4cca99,Institute of Electrical and Electronics Engineers Inc.,"3rd ACM/IEEE Symposium on Edge Computing, SEC 2018",3,Blockchain; Dynamic risk management; Edge computing,English,Scopus,"Banks play an important role in the financial market, and their profit mainly comes from loan service. Traditional risk management approaches, as the key part in the loan services, still have several issues including low data credibility, unreliable checking and alert delay. We propose a novel dynamic credit risk management system which leverages edge-based blockchain technology to improve the performance and provide a fair loan environment. Besides, we discuss the potential challenges that the system may face, such as data standards, security on edge and scalability. © 2018 IEEE"
Mendki P.,"Mendki, P., Talentica Software Pvt Ltd, Pune, 411045, India",Blockchain enabled IoT edge computing,ACM International Conference Proceeding Series,9.78E+12,nan,2019,Part F148153,nan,10.1145/3320/15433/20166,https://www.scopus.com/inward/record.uri?eid=2-s2.0-85066482112&doi=10.1145%2f3320%2f15433%2f20166&partnerID=40&md5=cb4863c82d3252aa80b10595cb74b730,Association for Computing Machinery,"2019 International Conference on Blockchain Technology, ICBCT 2019",4,Blockchain; Edge computing; Hyperledger sawtooth; IoT,English,Scopus,"Number of internet connected devices is increasing as IoT is getting more prevalent. Volume of data collected by IoT sensors is very high and requires considerable resources for data processing like analytics. Edge processing enables getting the sensor data processed closer to the source. It’s not always possible and/or economical to set up a resource intense infrastructure at the edge. This paper proposes use of blockchain based decentralized application to enable IoT edge processing. With this setup, it is possible for a resource owner to join the ecosystem and to lend the compute resources as needed. IoT devices can offload some of the edge computation to the resource owner nodes as and when required. This paper explains architectural components and overall solution for implementation. Based on the usecase of video analytics at edge, experimental setup is implemented for the IoT edge solution using hyperledger sawtooth blockchain. © 2019 Association for Computing Machinery."
"Mitra S., Bose S., Gupta S.S., Chattopadhyay A.","Mitra, S., Dept. of Computer Science and Engineering, Techno International New Town, Kolkata, India; Bose, S., School of Computer Science and Engineering, Nanyang Technological University, Singapore; Gupta, S.S., School of Computer Science and Engineering, Nanyang Technological University, Singapore; Chattopadhyay, A., School of Computer Science and Engineering, Nanyang Technological University, Singapore",Secure and Tamper-resilient Distributed Ledger for Data Aggregation in Autonomous Vehicles,"2018 IEEE Asia Pacific Conference on Circuits and Systems, APCCAS 2018",9.78E+12,"Chengdu University of Information Tecnology (CUIT);Digilent;Institute of Integrated Circuits and Systems (IICS), UESTC;Publishing House of Electronics Industry (PHEI);UESTC",2019,nan,nan,10.1109/APCCAS.2018.8605625,https://www.scopus.com/inward/record.uri?eid=2-s2.0-85062220119&doi=10.1109%2fAPCCAS.2018.8605625&partnerID=40&md5=ff5d1c82fc7ecb8bc8324b7a9d4dad02,Institute of Electrical and Electronics Engineers Inc.,"14th IEEE Asia Pacific Conference on Circuits and Systems, APCCAS 2018",4,authenticity; autonomous vehicles; blockchain; data aggregation; distributed ledger; tamper-resilience,English,Scopus,"The phases those turn the wheels of an autonomous vehicle, are perception, decision and actuation. Among these, the major highlight of recent research has been perception through diverse sensors, and decision through an ever-Aggressive cloud/fog/mist computing setup. In this paper, we take a closer look into the flow of data, both internal and external to the autonomous vehicle. We argue that confidentiality, integrity and availability of these data are critical to the eventual adoption of higher-level security and privacy mechanisms in autonomous vehicles. To that effect, we propose a secure and tamper-resilient distributed ledger as an underlying enabler for intra-vehicular data aggregation, and study its security and privacy issues under appropriate adversarial models, where the distributed ledger is instantiated as a standard consortium blockchain. © 2018 IEEE."
"Xu F., Yang F., Zhao C., Fang C.","Xu, F., Key Lab. of Universal Wireless Communications, MOE, Beijing University of Posts and Telecommunications, Beijing, China; Yang, F., Key Lab. of Universal Wireless Communications, MOE, Beijing University of Posts and Telecommunications, Beijing, China; Zhao, C., Key Lab. of Universal Wireless Communications, MOE, Beijing University of Posts and Telecommunications, Beijing, China; Fang, C., Faculty of Information Technology, Beijing University of Technology, Beijing, China",Edge Computing and Caching based Blockchain IoT Network,"Proceedings of 2018 1st IEEE International Conference on Hot Information-Centric Networking, HotICN 2018",9.78E+12,IEEE Beijing Section;Peking University Shenzhen Graduate School;Shenzhen Key Lab for Information Centric Networking and Blockchain Technology (ICNLAB),2019,nan,nan,10.1109/HOTICN.2018.8606001,https://www.scopus.com/inward/record.uri?eid=2-s2.0-85062026463&doi=10.1109%2fHOTICN.2018.8606001&partnerID=40&md5=cedcc11b98ccad37cb694b7fa60f78d0,Institute of Electrical and Electronics Engineers Inc.,"1st IEEE International Conference on Hot Information-Centric Networking, HotICN 2018",2,blockchain; caching; computation; edge computing; internet of things,English,Scopus,"With the development of internet of things (IoT) network in recent years, while the centralization data management brings longer delay while has more safety troubles. Moreover, once a single device is attacked, the system crashes. So, blockchain technique which could realize safety distributed data management is introduced. However, the consensus mechanism of blockchain consumes huge computation resources. And the storage of entire ledger also consumes huge storage resources of the blockchain nodes. Due to the limited capacity of IoT devices, the nodes cannot afford the computation resources to reach consensus and caching resources. This paper introduces an architecture of edge computing based blockchain network which makes use of the computation and caching capacity of edge server to help the IoT devices in reaching consensus and storing data. © 2018 IEEE."
"Zhang X., Li R., Cui B.","Zhang, X., College of Computer Science, Inner Mongolia University, Hohhot, China; Li, R., College of Computer Science, Inner Mongolia University, Hohhot, China; Cui, B., College of Computer Science, Inner Mongolia University, Hohhot, China",A security architecture of VANET based on blockchain and mobile edge computing,"Proceedings of 2018 1st IEEE International Conference on Hot Information-Centric Networking, HotICN 2018",9.78E+12,IEEE Beijing Section;Peking University Shenzhen Graduate School;Shenzhen Key Lab for Information Centric Networking and Blockchain Technology (ICNLAB),2019,nan,nan,10.1109/HOTICN.2018.8605952,https://www.scopus.com/inward/record.uri?eid=2-s2.0-85062021101&doi=10.1109%2fHOTICN.2018.8605952&partnerID=40&md5=521579ce2b71269684e117d21e439f39,Institute of Electrical and Electronics Engineers Inc.,"1st IEEE International Conference on Hot Information-Centric Networking, HotICN 2018",2,blockchain; mobile edge computing; security; VANET,English,Scopus,"The development of Vehicular Ad-hoc NETwork (VANET) has brought many conveniences to human beings, but also brings a very prominent security problem. The traditional solution to the security problem is based on centralized approach which requires a trusted central entity which exists a single point of failure problem. Moreover, there is no approach of technical level to ensure security of data. Therefore, this paper proposes a security architecture of VANET based on blockchain and mobile edge computing. The architecture includes three layers, namely perception layer, edge computing layer and service layer. The perception layer ensures the security of VANET data in the transmission process through the blockchain technology. The edge computing layer provides computing resources and edge cloud services to the perception layer. The service layer uses the combination of traditional cloud storage and blockchain to ensure the security of data. © 2018 IEEE."
Freitag F.,"Freitag, F., Department of Computer Architecture, Technical University of Catalunya, Barcelona, Spain",On the Collaborative Governance of Decentralized Edge Microclouds with Blockchain-Based Distributed Ledgers,"Proceedings - 2018 IEEE/WIC/ACM International Conference on Web Intelligence, WI 2018",9.78E+12,nan,2019,nan,nan,10.1109/WI.2018.000-7,https://www.scopus.com/inward/record.uri?eid=2-s2.0-85061939512&doi=10.1109%2fWI.2018.000-7&partnerID=40&md5=0be1e6cc5ab43b1a59fcc30a9abdbece,Institute of Electrical and Electronics Engineers Inc.,"18th IEEE/WIC/ACM International Conference on Web Intelligence, WI 2018",4,Decentralized clouds,English,Scopus,"Today's commercial model for edge computing services consists in lightweight devices at the network edge connected through the Internet to remote cloud data centers. Microclouds are an alternative vision of edge computing, where the cloud infrastructure runs at the network edge leveraging decentralized resource contributions of a community. But current attempts to build such microclouds lack a collaborative governance system to operate successfully. In this paper we discuss the opportunity to implement with blockchain technologies key services to enable the decentralized collaborative governance of microclouds. A multiagent approach could further contribute to improve the efficiency in the decision making in the collaborative governance service. © 2018 IEEE."
"Suppitaksakul C., Suwannakit W.","Suppitaksakul, C., Department of Electrical Engineering, Rajamangala University of Technology Thanyaburi, 39 Moo 1 Klong 6, Thanyaburi, Pathumthani, Thailand; Suwannakit, W., Department of Electrical Engineering, Rajamangala University of Technology Thanyaburi, 39 Moo 1 Klong 6, Thanyaburi, Pathumthani, Thailand",A combination of corrugated cardboard images using image stitching technique,"ECTI-CON 2018 - 15th International Conference on Electrical Engineering/Electronics, Computer, Telecommunications and Information Technology",9.78E+12,nan,2019,nan,nan,10.1109/ECTICon.2018.8619927,https://www.scopus.com/inward/record.uri?eid=2-s2.0-85062240222&doi=10.1109%2fECTICon.2018.8619927&partnerID=40&md5=1880c3eea7bb35657466428e67431128,Institute of Electrical and Electronics Engineers Inc.,"15th International Conference on Electrical Engineering/Electronics, Computer, Telecommunications and Information Technology, ECTI-CON 2018",4,Area scan camera; Counting corrugated cardboard; Image stitching,English,Scopus,"This paper presents image stitching technique to combine corrugated cardboard images in order to have an image of the whole pile of cardboard. Image stitching algorithm is consist of the corner feature detection using Forstner method, feature matching while inconsistent features are eliminated by random sample consensus (RANSAC) and using bundle adjustment for image composition by refining the output image position. After that, this algorithm is tested to combine cardboard images on cut-off side type BC, 5 sheets simulated using HALCON program. The experimental results show that the proposed algorithm can combine cut-off side images correctly when they are overlapped about 25%. Then the output of the combined image is investigated by manually counting compared with the real number of the cardboard and it is found that the corresponding result is given. © 2018 IEEE"
